chuzu,ditie,fukuan,jiage,louceng,mianji,xiaoqu,zhuangxiu整租,距离地铁北沙滩470米,押2付3,10000,顶层/6层,108,北沙滩1号院,豪装
整租,距离地铁双井640米,押2付3,22000,中楼层/12层,156.42,世桥国贸,精装
整租,距离地铁健德门540米,押1付3,5500,中楼层/11层,50,华严北里2号院,精装
整租,距离地铁北沙滩537米,押2付3,8500,顶层/18层,99,公安局宿舍,精装
整租,,押2付3,4500,中楼层/6层,78,朝阳新城五区,中装
整租,距离地铁北沙滩627米,押1付3,9000,高楼层/22层,102,天和人家,精装
整租,距离地铁大郊亭856米,押2付3,23000,高楼层/25层,166.59,万科蓝山,精装
整租,距离地铁大望路635米,押2付3,5500,中楼层/7层,43.41,西大望路北小区,中装
整租,距离地铁九龙山774米,押2付3,11000,高楼层/22层,97.3,苹果社区南区,精装
整租,距离地铁东四十条610米,押1付3,12500,低楼层/25层,78,阳光都市,精装
整租,,押1付3,5200,高楼层/22层,85,朝新嘉园西里,精装
整租,距离地铁青年路1300米,押2付3,33000,底层/31层,294,国美第一城2号院,豪装
整租,,押2付3,15000,底层/30层,237,富力又一城C区,精装
合租,距离地铁北苑1102米,押2付3,2600,高楼层/23层,25,广华居,精装
整租,距离地铁广渠门外806米,押2付3,14000,中楼层/18层,131,CBD总部公寓二期,精装
整租,距离地铁立水桥南417米,押1付3,15000,中楼层/32层,133,天居园,精装
整租,距离地铁四惠东959米,押2付3,7800,中楼层/14层,94,甘露西园,精装
整租,距离地铁芍药居116米,押2付3,7500,低楼层/24层,80,芍药居,精装
整租,距离地铁四惠东358米,押2付3,4500,中楼层/6层,45,康家园,中装
整租,,押1付3,8000,低楼层/9层,114,银枫家园,精装
整租,距离地铁传媒大学1080米,押1付4,4000,中楼层/6层,45,天泰新房苑小区,中装
随时看房,距离地铁惠新西街北口230米,,43000,低楼层/25层,330,千鹤家园,精装
整租,距离地铁双井755米,押2付3,15000,低楼层/24层,136.65,合生国际花园,精装
整租,距离地铁双井755米,押2付3,28000,底层/24层,181.86,合生国际花园,精装
整租,距离地铁潘家园346米,押2付3,26000,高楼层/21层,251,紫东苑,精装
整租,,押2付3,10000,底层/3层,240,东旭花园别墅,精装
合租,距离地铁潘家园693米,押1付3,2500,底层/6层,75,华威西里,中装
整租,,押1付3,6500,高楼层/28层,86,东洲家园,精装
整租,距离地铁亮马桥644米,押2付3,28000,中楼层/31层,228,US联邦公寓,精装
整租,距离地铁惠新西街北口265米,押1付3,11000,高楼层/11层,136,惠新苑,中装
整租,,押2付3,4500,顶层/3层,78,世豪花园,精装
整租,距离地铁农业展览馆981米,押2付3,43000,中楼层/21层,266,首开铂郡,精装
整租,距离地铁大望路350米,押2付3,11000,低楼层/27层,67.58,华贸国际公寓,中装
整租,距离地铁东大桥615米,押2付3,18000,高楼层/23层,166,康堡花园,精装
整租,距离地铁金台夕照477米,押2付3,40000,低楼层/36层,180,新城国际,精装
整租,距离地铁欢乐谷景区277米,押2付3,17000,高楼层/30层,214,北京华侨城,精装
整租,距离地铁金台夕照477米,押1付3,30000,低楼层/33层,165,新城国际,精装
整租,距离地铁九龙山365米,押2付3,20000,中楼层/20层,166,珠江帝景B区,精装
整租,距离地铁金台路505米,押2付3,7000,中楼层/16层,65,金台里,精装
整租,,押2付3,8000,中楼层/9层,96,首开常青藤一期,中装
整租,距离地铁百子湾867米,押2付3,9000,中楼层/22层,98,沿海赛洛城七期,精装
整租,距离地铁青年路1058米,押2付3,15000,低楼层/19层,108.42,阿曼寓所,简装
整租,距离地铁潘家园693米,押2付3,6000,低楼层/6层,63.53,华威西里,精装
整租,距离地铁褡裢坡830米,押2付3,17000,顶层/8层,175,鲁班大厦,精装
整租,距离地铁劲松335米,押2付3,6500,低楼层/12层,60,农光里小区,中装
整租,距离地铁北沙滩755米,押1付3,12000,顶层/9层,130,双泉堡甲2号院,精装
整租,距离地铁永安里643米,押2付3,10000,低楼层/30层,86,东方瑞景,中装
整租,距离地铁东湖渠173米,押1付3,18000,高楼层/21层,171,华彩国际公寓,精装
整租,距离地铁芍药居1068米,押2付3,7000,顶层/7层,90,芍药居北里一区,精装
整租,距离地铁芍药居1068米,押2付3,5000,中楼层/7层,48,芍药居北里一区,中装
整租,距离地铁北苑路北831米,押1付3,6500,中楼层/18层,62,景龙国际,精装
整租,距离地铁望京南679米,押2付3,1800,顶层/5层,15,大山子南里,简装
整租,距离地铁东风北桥254米,押2付3,6500,中楼层/25层,60,瞰都国际,中装
整租,距离地铁阜通600米,押2付3,7000,顶层/6层,64,中环南路11号院,精装
合租,距离地铁北苑522米,押2付3,2600,低楼层/25层,20,北苑家园紫绶园,中装
整租,距离地铁金台夕照477米,押2付3,20000,中楼层/31层,76,新城国际,中装
整租,距离地铁将台801米,押2付3,70000,低楼层/3层,200,嘉林花园别墅,精装
整租,距离地铁四惠464米,押2付3,14000,高楼层/16层,127,东恒时代二期A区,精装
整租,距离地铁将台1417米,押1付3,13000,中楼层/9层,109,卡布其诺,精装
整租,距离地铁将台1417米,押2付3,11500,高楼层/9层,107,卡布其诺,精装
整租,距离地铁金台路153米,押1付3,5000,中楼层/16层,45,金台北街,中装
整租,距离地铁九龙山365米,押1付3,17000,高楼层/29层,162,珠江帝景B区,精装
整租,距离地铁九龙山505米,押2付3,21000,低楼层/19层,189,珠江帝景C区,精装
整租,距离地铁东湖渠712米,押2付3,32000,低楼层/32层,192,东湖湾,豪装
合租,距离地铁北工大西门448米,押2付3,2600,低楼层/18层,20,磨房南里,中装
整租,距离地铁潘家园357米,押1付3,4500,顶层/6层,74.61,建业苑,精装
整租,距离地铁东四十条610米,押1付3,19500,低楼层/25层,175.34,阳光都市,中装
整租,距离地铁建国门763米,押2付3,15000,中楼层/16层,81,丽舍公寓,中装
整租,距离地铁劲松335米,押2付3,6500,中楼层/6层,64,农光里小区,精装
合租,距离地铁欢乐谷景区1194米,押2付3,2500,底层/6层,61,垡头西里,中装
整租,距离地铁九龙山491米,押2付3,75000,底层/10层,82.62,金港国际,精装
整租,距离地铁大望路350米,押2付3,17000,低楼层/13层,90,华贸国际公寓,豪装
整租,距离地铁大屯路东516米,押1付3,44000,高楼层/10层,176.74,华悦国际公寓,精装
整租,距离地铁芍药居572米,押1付12,42000,低楼层/24层,220,太阳公元1组团,豪装
合租,距离地铁潘家园451米,押1付3,3000,中楼层/6层,20,武圣西里,豪装
整租,距离地铁北苑522米,押2付3,10000,高楼层/13层,100,北苑家园紫绶园,精装
整租,距离地铁望京西566米,押2付3,7000,中楼层/25层,70,北京香颂,精装
整租,距离地铁立水桥南417米,押2付3,7980,高楼层/32层,88,天居园,精装
整租,距离地铁永安里643米,押2付3,9800,中楼层/30层,86,东方瑞景,中装
整租,距离地铁北苑243米,押2付3,30000,底层/3层,244.48,时代庄园,中装
整租,距离地铁双井769米,押2付3,22000,中楼层/12层,165,御宸上院,豪装
整租,距离地铁青年路1300米,押2付3,15000,中楼层/27层,138.92,国美第一城2号院,中装
整租,距离地铁北苑路北745米,押2付3,13000,中楼层/32层,133,上元,精装
整租,,押1付3,15000,低楼层/11层,138,丽都壹号,精装
合租,,押2付3,2300,高楼层/28层,16,翠成馨园D区,精装
整租,距离地铁惠新西街北口230米,押2付3,45000,高楼层/25层,293,千鹤家园,中装
整租,距离地铁百子湾943米,押1付3,13500,顶层/18层,145,沿海赛洛城六期,精装
整租,距离地铁双井769米,押2付3,22000,顶层/27层,168,御宸上院,中装
整租,距离地铁潘家园409米,押2付3,10000,顶层/6层,129,松榆西里,精装
整租,距离地铁北苑243米,押2付3,18000,中楼层/5层,207,时代庄园,精装
整租,,押2付3,5500,高楼层/28层,87,汇景苑,简装
整租,距离地铁四惠东726米,押2付3,5500,高楼层/13层,49.15,都市经典家园,精装
整租,距离地铁金台路1026米,押2付3,15000,中楼层/25层,154.15,延静里中街3号院,中装
整租,,押2付3,5500,高楼层/25层,90,汇景苑,中装
整租,距离地铁望京南530米,押2付3,6000,底层/16层,55,高家园四区,中装
整租,距离地铁团结湖751米,押1付3,29000,低楼层/29层,181.92,三里屯SOHO公寓,精装
整租,距离地铁安立路833米,押1付3,28000,中楼层/17层,228,名人公寓,精装
整租,距离地铁九龙山676米,押2付3,13000,底层/17层,126,易构空间,精装
整租,距离地铁呼家楼400米,押2付3,8500,中楼层/15层,75,关东店北街,精装
整租,,押1付3,6500,高楼层/22层,85,东洲家园,精装
合租,距离地铁双井755米,押1付3,3600,低楼层/18层,92.62,合生国际花园,精装
整租,距离地铁十里堡858米,押2付3,6000,高楼层/28层,60,炫特嘉园,中装
整租,距离地铁国贸342米,押2付3,63000,底层/30层,210,建外SOHO,中装
整租,距离地铁金台路258米,押2付3,18000,低楼层/22层,158,公园5号,精装
合租,距离地铁金台路505米,押2付3,3500,中楼层/12层,45,金台里,精装
整租,距离地铁朝阳公园708米,押2付3,15000,低楼层/31层,89,公园大道,精装
整租,距离地铁北苑路北831米,押2付3,6500,低楼层/18层,60.61,景龙国际,中装
合租,距离地铁欢乐谷景区547米,押2付3,2300,中楼层/25层,20,金蝉南里,简装
合租,距离地铁亮马桥1184米,押1付3,2600,中楼层/5层,18,新源里西,中装
整租,距离地铁双桥334米,押2付3,4300,顶层/6层,50,双柳巷小区,精装
整租,,押2付3,26000,中楼层/5层,253,海棠公社,中装
整租,距离地铁金台夕照816米,押1付3,20500,低楼层/31层,190.02,中国第一商城,中装
整租,距离地铁欢乐谷景区277米,押2付3,10000,底层/18层,102,北京华侨城,精装
整租,距离地铁百子湾655米,押2付3,24000,底层/8层,65,沿海赛洛城一期,精装
整租,距离地铁团结湖751米,押2付3,36000,高楼层/29层,193.49,三里屯SOHO公寓,精装
整租,距离地铁广渠门外510米,押2付3,32000,低楼层/20层,237.07,富力城D区,精装
整租,距离地铁常营696米,押2付3,7500,中楼层/28层,72,管庄北二里,中装
整租,距离地铁双桥777米,押2付3,27000,底层/20层,286,水郡长安2号院,中装
整租,距离地铁九龙山355米,押2付3,42000,高楼层/11层,258,乐成公馆,精装
整租,距离地铁望京南679米,押2付3,5200,中楼层/6层,45,大山子南里,中装
整租,距离地铁望京南930米,押1付3,5000,中楼层/18层,65,荧屏里,中装
整租,,押1付3,6500,底层/22层,89,东洲家园,毛坯
整租,,押1付3,6000,低楼层/22层,89,东洲家园,毛坯
整租,距离地铁三元桥540米,押2付3,6800,高楼层/6层,58,霞光里30号院,中装
整租,距离地铁四惠464米,押2付3,8600,低楼层/21层,74,东恒时代二期A区,精装
整租,,押1付3,13500,中楼层/9层,130,梵谷水郡,中装
合租,距离地铁双桥334米,押1付3,2200,中楼层/5层,24,双柳巷小区,中装
整租,距离地铁望京南168米,押2付3,7700,低楼层/33层,75,蓝色家园,精装
整租,距离地铁芍药居116米,押1付3,7000,底层/14层,80,芍药居,中装
整租,距离地铁潘家园693米,押2付3,6700,高楼层/22层,70,华威西里,中装
整租,距离地铁望京南679米,押2付3,10000,底层/4层,85,大山子南里,中装
整租,距离地铁金台路250米,押1付3,8500,顶层/6层,78,延静里,简装
整租,距离地铁欢乐谷景区1194米,押2付3,4200,高楼层/6层,42,垡头西里,中装
整租,距离地铁大郊亭674米,押2付3,7000,底层/20层,65,后现代城,精装
整租,距离地铁太阳宫1361米,押2付3,11000,中楼层/22层,97.89,鹿港嘉苑,精装
整租,,押2付3,24000,高楼层/26层,254.07,银枫家园,豪装
整租,距离地铁三元桥442米,押2付3,16000,中楼层/29层,88.94,远洋新干线,中装
整租,距离地铁东风北桥918米,押2付3,23500,低楼层/35层,156,阳光上东,精装
整租,距离地铁双井695米,押2付3,60000,高楼层/21层,278.06,富力十号,精装
整租,距离地铁欢乐谷景区277米,押1付3,10000,中楼层/30层,87,北京华侨城,豪装
整租,距离地铁双井769米,押2付3,15000,高楼层/32层,130,御宸上院,精装
整租,距离地铁潘家园635米,押2付3,7500,顶层/22层,80,汉华苑,中装
整租,距离地铁双井769米,押2付3,17000,底层/25层,165,御宸上院,豪装
整租,距离地铁立水桥1047米,押2付3,12000,中楼层/27层,125,世华泊郡,中装
合租,距离地铁北沙滩534米,押1付3,2500,中楼层/6层,15,北沙滩6号院,精装
整租,距离地铁北苑1463米,押2付3,100000,底层/3层,560,润泽庄园,豪装
整租,距离地铁太阳宫580米,押1付6,22000,中楼层/20层,196.93,太阳国际公馆,精装
整租,距离地铁北苑路北529米,押2付3,17000,中楼层/32层,165,天畅园,精装
整租,距离地铁森林公园南门683米,押2付3,23000,低楼层/9层,195,国奥村,精装
整租,距离地铁阜通597米,押1付3,5500,中楼层/9层,48.72,嘉悦精英家园,中装
整租,距离地铁双井755米,押2付3,12000,中楼层/18层,92.62,合生国际花园,精装
整租,距离地铁北苑243米,押2付3,19000,底层/1层,160.96,时代庄园,精装
整租,距离地铁传媒大学566米,押1付3,4500,高楼层/6层,58,花园闸北里小区,中装
整租,距离地铁国贸342米,押2付3,30000,底层/30层,150,建外SOHO,精装
整租,距离地铁北工大西门879米,押2付3,11000,中楼层/23层,110,美景东方,中装
整租,距离地铁广渠门外510米,押2付3,26000,低楼层/18层,193.36,富力城D区,中装
整租,距离地铁惠新西街北口871米,押1付3,6500,中楼层/6层,68,高原街小区,精装
整租,,押2付3,12000,高楼层/9层,137,银枫家园,精装
整租,距离地铁惠新西街北口302米,押1付3,26000,低楼层/21层,254,蓝珏苑,精装
整租,距离地铁东风北桥254米,押2付3,7500,低楼层/25层,60.05,瞰都国际,精装
整租,距离地铁北苑243米,押1付3,33000,底层/3层,246.34,时代庄园,简装
整租,距离地铁双井565米,押1付3,22000,中楼层/17层,186.96,富力城B区,精装
整租,距离地铁大望路350米,押2付3,70800,低楼层/13层,264.65,华贸国际公寓,精装
整租,距离地铁大郊亭851米,押2付3,7000,低楼层/25层,50,大成国际,豪装
整租,距离地铁关庄1431米,押2付3,46000,底层/3层,376,亚运新新家园,精装
整租,距离地铁光熙门527米,押2付3,18500,高楼层/30层,160,英特公寓,精装
整租,距离地铁十里堡889米,押1付3,4800,中楼层/16层,38,天天朝阳,中装
整租,距离地铁金台夕照816米,押2付3,21000,低楼层/36层,190.02,中国第一商城,中装
整租,距离地铁北苑705米,押2付3,4200,中楼层/14层,30,清友园,精装
整租,距离地铁森林公园南门683米,押2付3,36000,中楼层/9层,240,国奥村,精装
整租,距离地铁百子湾652米,押1付3,35000,中楼层/20层,340,沿海赛洛城四期,中装
整租,,押2付3,4000,中楼层/6层,59,康静里,精装
整租,距离地铁永安里157米,押2付3,35000,低楼层/22层,290,丽晶苑,简装
电话预约,距离地铁大望路391米,,16000,高楼层/29层,145,阳光100国际公寓,中装
整租,距离地铁大望路350米,押2付3,17000,高楼层/27层,133,华贸国际公寓,中装
整租,距离地铁将台665米,押2付3,11000,低楼层/24层,95.79,风景线,精装
整租,距离地铁东四十条894米,押2付3,75000,低楼层/25层,373,永利国际,精装
合租,距离地铁北沙滩848米,押2付3,3000,高楼层/6层,18,龙欣苑,中装
整租,距离地铁东风北桥254米,押2付3,9500,低楼层/25层,88,瞰都国际,精装
整租,距离地铁大望路236米,押2付3,28000,高楼层/30层,198.04,现代城,精装
整租,距离地铁青年路1300米,押2付3,5000,低楼层/3层,70,国美第一城2号院,精装
整租,距离地铁安立路593米,押1付3,15000,高楼层/30层,126,阳光广场,精装
整租,距离地铁四惠708米,押2付3,12500,顶层/27层,136,东恒时代三期,精装
整租,距离地铁北工大西门879米,押1付12,8200,底层/21层,188,美景东方,中装
整租,距离地铁大望路291米,押2付3,25000,低楼层/32层,190,金地国际花园,精装
合租,距离地铁潘家园387米,押2付3,2400,低楼层/18层,13,华威北里,精装
整租,距离地铁团结湖751米,押1付3,28000,低楼层/29层,162.26,三里屯SOHO公寓,精装
整租,距离地铁奥体中心849米,押1付3,6000,中楼层/6层,95,华严北里小区,中装
整租,距离地铁团结湖751米,押1付3,40000,高楼层/29层,193,三里屯SOHO公寓,精装
整租,距离地铁安立路593米,押1付3,22000,高楼层/30层,177,阳光广场,精装
整租,,押3付1,139000,底层/3层,1000,银湖别墅,豪装
整租,距离地铁国贸342米,押2付3,40000,底层/30层,199.36,建外SOHO,中装
整租,距离地铁安立路322米,押1付12,33000,高楼层/18层,229,润枫德尚苑,精装
合租,距离地铁亮马桥890米,押2付3,4000,高楼层/6层,50,三里屯北小街,中装
整租,距离地铁焦化厂363米,押2付12,6000,中楼层/28层,100,祈东家园一期,精装
整租,距离地铁将台754米,押1付3,8500,高楼层/6层,63,酒仙桥中路3号院,精装
整租,距离地铁将台754米,押2付3,7500,中楼层/6层,90,酒仙桥中路3号院,中装
合租,距离地铁潘家园357米,押2付3,2600,顶层/6层,20,建业苑,精装
整租,距离地铁永安里747米,押2付3,42000,中楼层/35层,262,世贸国际公寓,精装
整租,距离地铁大屯路东881米,押2付12,7500,底层/1层,60,安慧北里,精装
整租,,押2付3,6000,中楼层/24层,87,东洲家园,中装
合租,距离地铁双井603米,押2付3,3500,高楼层/23层,95,非常生活,精装
整租,距离地铁三元桥250米,押2付3,17500,高楼层/36层,120,置地公寓,精装
整租,距离地铁农业展览馆981米,押1付3,38000,低楼层/18层,200,首开铂郡,豪装
整租,距离地铁劲松335米,押1付3,7000,底层/12层,45,农光里小区,中装
整租,距离地铁国贸342米,押2付3,36000,高楼层/30层,183,建外SOHO,精装
整租,距离地铁望京东717米,押2付3,23500,低楼层/28层,204.52,融科橄榄城,精装
整租,,押2付3,5000,底层/29层,90,汇景苑,毛坯
整租,距离地铁建国门342米,押2付3,15000,底层/19层,135,华侨村,中装
整租,距离地铁北苑路北608米,押1付3,20000,低楼层/4层,250,亚奥万和四季,毛坯
整租,距离地铁建国门650米,押2付3,15000,中楼层/15层,72,中海·枫丹公馆,精装
整租,距离地铁阜通600米,押2付3,6500,顶层/6层,64,中环南路11号院,中装
整租,距离地铁太阳宫580米,押1付3,20000,高楼层/23层,196,太阳国际公馆,简装
整租,距离地铁广渠门外306米,押2付3,45000,中楼层/5层,236,富力城E区,精装
整租,距离地铁东风北桥918米,押2付3,18500,中楼层/19层,131,阳光上东,豪装
整租,距离地铁阜通603米,押2付3,23000,中楼层/7层,158.98,大西洋新城,精装
整租,距离地铁百子湾827米,押2付3,9000,高楼层/20层,89.06,金都杭城,中装
整租,距离地铁金台路425米,押2付3,6200,中楼层/17层,70,延静西里,精装
整租,距离地铁十里堡222米,押2付3,6000,顶层/18层,65,八里庄南里,中装
整租,距离地铁太阳宫288米,押2付3,30000,高楼层/27层,201,太阳星城火星园,精装
整租,距离地铁大望路291米,押2付3,60000,高楼层/33层,287.29,金地国际花园,中装
整租,距离地铁柳芳828米,押2付3,8500,高楼层/20层,58,MASTER领寓,精装
整租,距离地铁团结湖1157米,押2付3,8000,低楼层/21层,136.2,首开幸福广场,精装
整租,距离地铁潘家园1176米,押2付3,13000,中楼层/26层,100,漪龙台,精装
整租,距离地铁永安里643米,押2付3,4000,中楼层/30层,87,东方瑞景,中装
整租,距离地铁双井459米,押1付3,30000,低楼层/20层,224.66,富力城C区,精装
整租,距离地铁北苑1463米,押2付3,27000,底层/3层,360,润泽庄园,毛坯
整租,距离地铁焦化厂1300米,押1付3,4500,低楼层/19层,53,恒大领寓,精装
整租,距离地铁建国门650米,押2付3,17000,高楼层/15层,80,中海·枫丹公馆,精装
整租,距离地铁潘家园409米,押2付3,8000,低楼层/6层,80,松榆西里,精装
整租,距离地铁呼家楼211米,押2付3,3500,低楼层/5层,65,向军北里,中装
整租,距离地铁光熙门527米,押2付3,19000,高楼层/30层,153,英特公寓,中装
整租,距离地铁团结湖751米,押1付3,28000,高楼层/28层,149.06,三里屯SOHO公寓,精装
整租,距离地铁光熙门527米,押2付3,12000,低楼层/29层,93.09,英特公寓,中装
整租,距离地铁安立路833米,押2付3,29000,中楼层/17层,228,名人公寓,精装
整租,距离地铁立水桥南223米,押2付3,25000,顶层/10层,252,华发颐园,豪装
随时看房,距离地铁南楼梓庄619米,押1付3,3500,高楼层/21层,100,世纪东方城,精装
随时看房,距离地铁国贸342米,押2付3,41300,中楼层/30层,202,建外SOHO,精装
整租,距离地铁立水桥南865米,押1付3,35000,顶层/27层,263,万达大湖公馆,豪装
电话预约,距离地铁永安里430米,押2付3,60000,底层/32层,400,通用时代国际公寓,精装
电话预约,距离地铁潘家园1176米,押1付3,25000,低楼层/26层,151,漪龙台,精装
整租,距离地铁安立路593米,押2付3,13000,高楼层/18层,116,阳光广场,精装
整租,距离地铁东风北桥254米,押1付3,28000,高楼层/25层,140,瞰都国际,精装
整租,,押1付12,50000,底层/4层,530,中海安德鲁斯庄园,豪装
合租,距离地铁呼家楼211米,押2付3,3500,顶层/6层,20,向军北里,精装
整租,距离地铁南楼梓庄299米,押1付3,8000,中楼层/30层,90,官悦欣园,中装
整租,距离地铁芍药居116米,押2付3,7500,高楼层/12层,100,芍药居,中装
整租,距离地铁大郊亭674米,押2付3,6000,底层/3层,11.71,后现代城,中装
合租,距离地铁呼家楼211米,押2付3,3600,高楼层/18层,20,向军北里,精装
整租,距离地铁常营696米,押1付3,5800,中楼层/28层,78,管庄北二里,精装
整租,,押2付3,6200,中楼层/6层,56,北窑地,精装
整租,距离地铁望京东450米,押2付3,8500,高楼层/24层,79,宝星国际,精装
整租,距离地铁望京东450米,押2付3,8500,底层/25层,64,宝星国际,中装
整租,距离地铁团结湖270米,押2付3,8200,低楼层/12层,56.65,白家庄北里,精装
整租,距离地铁团结湖270米,押2付3,8000,底层/18层,56,白家庄北里,中装
距离地铁十里堡889米,距离地铁十里堡889米,押1付3,4800,顶层/16层,38,天天朝阳,电话预约
欢乐谷,距离地铁欢乐谷景区277米,押1付3,15000,高楼层/18层,204,北京华侨城,整租
整租,距离地铁欢乐谷景区639米,押2付3,4300,中楼层/21层,55,金蝉里,精装
距离地铁广渠门外444米,距离地铁广渠门外444米,押2付3,9200,低楼层/7层,100,双花园西里,随时看房
距离地铁关庄198米,距离地铁关庄198米,押2付3,28333,底层/15层,163,嘉铭桐城B区,电话预约
整租,距离地铁将台776米,押2付3,15000,底层/28层,157,丽都东方国际公寓,精装
整租,距离地铁北苑901米,押1付3,6800,中楼层/6层,98,赢秋苑,精装
整租,距离地铁国贸342米,押2付3,23000,底层/36层,160,建外SOHO,中装
整租,距离地铁北苑1445米,押1付3,7500,中楼层/6层,110,北京青年城,精装
合租,距离地铁潘家园193米,押1付3,2700,低楼层/6层,18,松榆北路,中装
合租,距离地铁东风北桥788米,押2付3,2800,底层/1层,16,酒仙桥七街坊,简装
整租,距离地铁四惠东716米,押2付3,7500,顶层/18层,99,甘露园南里二区,中装
整租,距离地铁立水桥南164米,押1付3,6800,中楼层/16层,69.17,领地OFFICE,精装
整租,距离地铁青年路494米,押2付3,12000,高楼层/24层,135.88,朝阳雅筑,简装
整租,距离地铁建国门560米,押2付3,12000,低楼层/21层,152,嘉华世纪,中装
整租,距离地铁永安里570米,押2付3,10800,高楼层/27层,45.47,长安驿,豪装
整租,距离地铁欢乐谷景区735米,押3付3,5200,低楼层/18层,88,金蝉北里,中装
整租,距离地铁望京东691米,押2付3,24000,中楼层/15层,158.76,宝星华庭,精装
整租,距离地铁双井668米,押1付12,12000,中楼层/28层,89,首城国际,精装
整租,距离地铁东直门1074米,押1付3,23000,高楼层/19层,228,锦绣园,精装
整租,距离地铁欢乐谷景区735米,押2付3,4200,底层/7层,60,金蝉北里,中装
整租,距离地铁团结湖270米,押1付3,7500,高楼层/6层,65,白家庄北里,中装
整租,距离地铁望京东553米,押2付3,16000,顶层/11层,139,慧谷阳光,精装
整租,距离地铁望京东450米,押2付3,7500,低楼层/22层,64,宝星国际,精装
整租,距离地铁黄渠653米,押2付3,3800,低楼层/11层,70,苹果派,中装
整租,,押2付3,5000,顶层/6层,77,朝阳新城二区,中装
整租,距离地铁北苑1181米,押1付3,16000,中楼层/12层,177,润泽悦溪,精装
整租,距离地铁黄渠653米,押2付3,3600,低楼层/11层,70,苹果派,中装
整租,距离地铁三元桥657米,押2付3,5200,高楼层/16层,45,三源里北小街,中装
整租,距离地铁潘家园378米,押1付2,20000,中楼层/28层,215.36,翌景嘉园,精装
