chuzu,ditie,fukuan,jiage,louceng,mianji,xiaoqu,zhuangxiu整租,距离地铁大屯路东1333米,押2付3,17000,中楼层/9层,182,康斯丹郡,中装
整租,距离地铁东大桥630米,押1付12,12000,底层/6层,58,天福园,精装
整租,距离地铁南楼梓庄839米,押1付3,30000,低楼层/25层,278.85,华瀚国际,精装
整租,距离地铁十里河364米,押2付3,16000,低楼层/38层,192,御景园,精装
整租,距离地铁潘家园273米,押1付3,6300,中楼层/28层,68.95,百环花园,中装
整租,,押2付3,6000,中楼层/22层,88,东洲家园,中装
整租,距离地铁大屯路东785米,押2付3,6000,低楼层/22层,65,欧陆经典风格派,精装
整租,距离地铁阜通1016米,押1付3,6500,低楼层/6层,65,花家地西里一区,中装
整租,距离地铁北苑路北841米,押2付3,12700,中楼层/16层,156,北卫新园,精装
整租,距离地铁北苑1329米,押2付3,8000,中楼层/23层,88.73,润泽公馆,精装
整租,距离地铁东直门85米,押1付3,8000,中楼层/14层,65,东城区东直门外大街,中装
整租,距离地铁望京南906米,押2付3,22000,高楼层/27层,176,国风上观,精装
整租,距离地铁望京南670米,押1付3,5000,低楼层/6层,48.79,金兴路,精装
整租,距离地铁惠新西街北口230米,押1付3,11000,中楼层/25层,110,千鹤家园,中装
整租,距离地铁安德里北街1068米,押2付3,10000,低楼层/17层,100,泰利明苑,精装
合租,距离地铁惠新西街南口208米,押2付3,3500,中楼层/17层,25,惠新西街33号院,精装
整租,距离地铁永安里643米,押1付3,13000,低楼层/23层,87.03,东方瑞景,精装
整租,距离地铁九龙山365米,押1付3,35000,高楼层/21层,268,珠江帝景B区,精装
整租,距离地铁惠新西街南口398米,押2付3,5500,中楼层/6层,50,樱花园,中装
整租,距离地铁柳芳828米,押1付3,8500,底层/20层,58,MASTER领寓,豪装
整租,距离地铁建国门330米,押2付3,6000,高楼层/6层,60,建国门内大街,中装
整租,距离地铁望京南679米,押1付3,5500,中楼层/5层,60,大山子南里,精装
整租,距离地铁管庄631米,押1付3,7000,顶层/28层,144.69,北京新天地一期,精装
整租,距离地铁褡裢坡995米,押2付3,7500,高楼层/21层,104,瑞和国际,精装
整租,距离地铁太阳宫288米,押2付3,13500,中楼层/26层,96,太阳星城火星园,精装
整租,距离地铁望京南168米,押2付3,23000,高楼层/33层,260,蓝色家园,精装
合租,,押1付3,2100,高楼层/28层,15,翠成馨园D区,精装
合租,距离地铁望京704米,押2付3,2600,顶层/20层,15,南湖中园二区,中装
整租,距离地铁南楼梓庄619米,押1付3,7500,低楼层/21层,92.98,世纪东方城,中装
整租,距离地铁十里堡222米,押1付3,6200,顶层/6层,56.55,八里庄南里,精装
整租,距离地铁亮马桥1184米,押2付3,6000,顶层/5层,61,新源里西,中装
整租,距离地铁惠新西街北口452米,押2付3,7500,低楼层/15层,60,三空间,精装
合租,距离地铁团结湖141米,押2付3,3500,底层/6层,20,团结湖北头条,中装
整租,距离地铁芍药居489米,押2付3,7000,中楼层/6层,60,芍药居14号院,中装
合租,距离地铁亮马桥657米,押1付3,2200,底层/6层,10,三源里南小街,简装
合租,距离地铁青年路847米,押1付3,3600,高楼层/25层,25,朝阳无限,中装
整租,距离地铁北沙滩775米,押1付3,6200,低楼层/6层,65,南沙滩小区,精装
整租,,押2付3,4500,中楼层/28层,60,翠成馨园D区,简装
整租,距离地铁安立路593米,押2付3,13000,中楼层/18层,126,阳光广场,中装
整租,距离地铁十里堡767米,押2付3,5000,高楼层/7层,58,十里堡东里,精装
合租,距离地铁阜通1016米,押2付3,2400,顶层/12层,15,花家地西里一区,中装
整租,距离地铁大屯路东500米,押1付6,13000,中楼层/25层,135,安慧北里逸园,精装
整租,距离地铁九龙山491米,押2付3,75000,底层/10层,108.93,金港国际,精装
整租,距离地铁四惠153米,押1付3,7000,低楼层/32层,65,东恒时代国际公寓,精装
整租,距离地铁惠新西街北口446米,押2付3,10000,中楼层/10层,138,惠新北里,中装
整租,距离地铁常营151米,押2付3,15000,高楼层/21层,141.58,龙湖长楹天街,精装
整租,距离地铁劲松269米,押1付3,6000,中楼层/5层,60,劲松三区,精装
整租,距离地铁传媒大学566米,押2付3,4800,中楼层/6层,58,花园闸北里小区,精装
整租,距离地铁三元桥516米,押2付3,7000,高楼层/6层,80,尚家楼48号院,中装
整租,距离地铁青年路1300米,押1付3,7500,高楼层/28层,77.46,国美第一城2号院,中装
整租,距离地铁北苑705米,押1付3,7500,高楼层/25层,102.71,清友园,精装
整租,距离地铁双井500米,押1付3,30000,底层/1层,35,富力城商业,精装
整租,距离地铁四惠153米,押1付3,9800,中楼层/32层,110,东恒时代国际公寓,精装
整租,距离地铁三元桥571米,押2付3,6500,顶层/6层,62.03,静安东里,中装
合租,距离地铁安立路502米,押2付3,2400,高楼层/24层,20,慧忠北里第一社区,精装
整租,距离地铁太阳宫420米,押2付3,7500,底层/21层,65,国展新座,精装
整租,距离地铁北苑路北841米,押2付3,15000,低楼层/16层,179,北卫新园,中装
整租,距离地铁褡裢坡1103米,押2付3,6000,低楼层/7层,108,东领鉴筑,精装
整租,距离地铁管庄953米,押1付3,6200,低楼层/9层,90,远洋一方润园2号院,精装
整租,距离地铁十里堡222米,押1付3,6000,低楼层/6层,65,八里庄南里,精装
整租,距离地铁太阳宫230米,押2付3,13000,高楼层/26层,94,丰和园19号院,精装
整租,,押2付3,5000,高楼层/28层,72,翠成馨园D区,中装
整租,距离地铁百子湾827米,押2付3,3500,中楼层/19层,40,金都杭城,中装
整租,距离地铁芍药居1068米,押2付3,5500,低楼层/14层,50,芍药居北里一区,中装
整租,距离地铁光熙门417米,押2付3,5800,高楼层/22层,45,光熙门北里,中装
整租,距离地铁永安里643米,押2付3,10000,底层/30层,104.4,东方瑞景,中装
整租,距离地铁安立路533米,押2付3,15000,低楼层/13层,140,华馨公寓,中装
合租,距离地铁将台1402米,押2付3,2600,中楼层/22层,15,电子城小区,简装
整租,距离地铁三元桥1111米,押2付3,5300,低楼层/6层,45,左家庄东里,中装
整租,距离地铁太阳宫288米,押2付3,13500,底层/21层,100,太阳星城火星园,精装
整租,距离地铁安立路862米,押2付3,7500,低楼层/25层,80,亚奥观典,精装
整租,距离地铁光熙门398米,押2付3,7000,中楼层/18层,70,樱花东街乙2号院,精装
整租,距离地铁光熙门448米,押2付3,14000,低楼层/27层,130,光熙家园,精装
整租,距离地铁将台1475米,押1付3,6500,高楼层/19层,107,上东三角洲,中装
整租,距离地铁安华桥240米,押2付3,6500,低楼层/6层,64,安贞西里三区,简装
整租,距离地铁望京308米,押2付3,7300,低楼层/22层,73,夏都盈座,中装
整租,距离地铁四惠东959米,押1付3,6900,高楼层/14层,84.75,甘露西园,中装
合租,距离地铁芍药居116米,押1付3,2500,底层/24层,20,芍药居,中装
合租,距离地铁北工大西门702米,押2付3,2500,中楼层/6层,15,武圣东里,中装
整租,距离地铁柳芳900米,押2付3,8500,中楼层/6层,75,西坝河中里,精装
整租,距离地铁将台1417米,押1付3,8500,高楼层/9层,92,卡布其诺,精装
合租,距离地铁平乐园587米,押2付3,2000,高楼层/16层,18,农光南路,中装
整租,,押2付3,6200,高楼层/22层,88,东洲家园,精装
整租,距离地铁呼家楼497米,押2付3,11800,顶层/6层,96.2,核桃园北里,精装
合租,距离地铁十里堡975米,押2付3,3200,高楼层/18层,71.22,石佛营东里,中装
整租,距离地铁北工大西门879米,押2付3,8200,底层/23层,85,美景东方,中装
整租,距离地铁望京南930米,押1付3,6500,高楼层/18层,65,荧屏里,中装
整租,距离地铁望京东783米,押2付3,21000,底层/25层,134,保利中央公园,精装
整租,距离地铁八里桥997米,押1付12,2200,中楼层/28层,16,康泉新城,中装
整租,距离地铁金台路453米,押2付3,7000,高楼层/16层,68,红庙北里,精装
整租,距离地铁芍药居513米,押2付3,14000,低楼层/22层,89,太阳公元2组团,精装
整租,距离地铁高碑店621米,押2付3,6000,低楼层/24层,67.55,兴隆家园二期,中装
整租,距离地铁北苑482米,押1付3,27000,低楼层/31层,199,福熙大道,精装
合租,距离地铁双桥334米,押1付3,2000,底层/6层,20,双柳巷小区,中装
整租,距离地铁团结湖751米,押2付3,37000,低楼层/29层,249,三里屯SOHO公寓,精装
整租,距离地铁双井381米,押2付3,13000,高楼层/14层,140,东环18,精装
整租,距离地铁建国门763米,押2付3,10000,高楼层/16层,55,丽舍公寓,精装
整租,距离地铁百子湾756米,押2付3,9500,中楼层/11层,90,百子湾8号院,精装
整租,距离地铁建国门763米,押2付3,11000,中楼层/16层,55,丽舍公寓,精装
整租,距离地铁柳芳828米,押2付3,10000,高楼层/20层,99,MASTER领寓,精装
整租,,押1付3,10500,高楼层/11层,88.8,丽都壹号,精装
整租,距离地铁北苑路北745米,押2付3,19000,低楼层/32层,198,上元,豪装
整租,距离地铁管庄1214米,押2付3,3500,高楼层/26层,45,东一时区,中装
合租,距离地铁潘家园1米,押2付3,2700,高楼层/6层,20,潘家园,简装
合租,距离地铁九龙山774米,押2付3,4000,高楼层/22层,96.13,苹果社区南区,精装
整租,距离地铁潘家园693米,押2付3,5500,底层/6层,53.62,华威西里,简装
整租,距离地铁永安里337米,押2付3,9000,中楼层/5层,65,光华里,精装
整租,距离地铁将台538米,押1付3,9800,中楼层/20层,108.73,晶都国际,中装
整租,距离地铁大屯路东1333米,押2付3,17000,中楼层/9层,154,康斯丹郡,精装
合租,距离地铁惠新西街南口398米,押2付3,3000,中楼层/6层,20,樱花园,简装
合租,距离地铁欢乐谷景区1194米,押2付3,2000,底层/6层,50,垡头西里,精装
整租,距离地铁惠新西街北口230米,押2付3,10000,低楼层/25层,102,千鹤家园,精装
整租,距离地铁三元桥571米,押1付12,6500,顶层/6层,61.9,静安东里,中装
整租,距离地铁广渠门外389米,押2付3,8700,高楼层/18层,106,广馨居,精装
整租,距离地铁十里河364米,押2付3,16000,中楼层/38层,189.75,御景园,简装
整租,距离地铁南楼梓庄619米,押1付6,7000,底层/14层,73.52,世纪东方城,简装
整租,距离地铁南楼梓庄619米,押1付3,12500,中楼层/21层,141,世纪东方城,精装
整租,距离地铁东大桥532米,押2付3,5500,底层/18层,40,工体南路,精装
合租,距离地铁惠新西街南口398米,押2付3,4000,高楼层/6层,20,樱花园,精装
整租,距离地铁青年路542米,押2付3,10000,中楼层/35层,122,朝阳园,中装
整租,距离地铁大屯路东516米,押2付3,21000,底层/12层,145,华悦国际公寓,精装
整租,距离地铁立水桥南861米,押1付3,10000,低楼层/14层,123,茉藜园,精装
合租,距离地铁十里堡1100米,押2付3,3000,低楼层/21层,18,特区808,精装
整租,距离地铁光熙门563米,押2付3,6600,中楼层/6层,65,西坝河西里,中装
合租,距离地铁草房524米,押2付3,3500,中楼层/23层,90.57,住欣家园,精装
合租,距离地铁北工大西门626米,押2付3,2500,低楼层/6层,20,松榆里,中装
整租,距离地铁建国门342米,押2付3,22000,高楼层/19层,170,华侨村,精装
整租,距离地铁双井808米,押2付3,5000,顶层/6层,45,光华宿舍,中装
整租,距离地铁传媒大学464米,押1付3,6800,高楼层/29层,90,北花园小区,精装
整租,距离地铁潘家园1282米,押2付3,16000,中楼层/24层,173.72,濠景阁,精装
合租,距离地铁广渠门外444米,押1付3,3000,高楼层/6层,70,双花园西里,精装
整租,,押2付3,5600,高楼层/27层,90,富力又一城C区,豪装
合租,距离地铁三元桥571米,押2付3,2900,顶层/6层,20,静安东里,简装
整租,距离地铁望京南679米,押2付3,5800,顶层/6层,65,大山子南里,中装
整租,距离地铁北苑522米,押1付3,16000,底层/12层,120,北苑家园紫绶园,中装
整租,,押2付3,12500,底层/9层,139,银枫家园,精装
整租,,押1付3,4000,底层/9层,60,梵谷水郡,中装
合租,距离地铁望京南558米,押1付3,1500,中楼层/6层,20,大山子北里,精装
整租,距离地铁太阳宫288米,押2付3,13500,高楼层/26层,102,太阳星城火星园,精装
整租,距离地铁大屯路东844米,押2付3,36000,底层/3层,183.4,紫玉山庄,中装
整租,距离地铁望京584米,押2付3,20000,高楼层/6层,180,望兴居,简装
整租,距离地铁欢乐谷景区277米,押2付3,12000,中楼层/12层,121.26,北京华侨城,精装
整租,距离地铁望京南930米,押2付3,6200,高楼层/18层,65,荧屏里,中装
合租,距离地铁潘家园693米,押2付3,2200,中楼层/6层,63.24,华威西里,精装
整租,距离地铁北工大西门644米,押2付3,7500,中楼层/6层,73.45,南新园,精装
整租,距离地铁望京南679米,押2付3,6500,中楼层/6层,65,大山子南里,中装
整租,距离地铁北苑482米,押1付3,15000,高楼层/31层,148,福熙大道,精装
整租,距离地铁永安里643米,押2付3,15000,低楼层/30层,133,东方瑞景,精装
整租,距离地铁双井346米,押2付3,6900,低楼层/21层,55.83,时代国际,中装
整租,距离地铁太阳宫139米,押2付3,8000,低楼层/20层,65,万方阿波罗计划,精装
整租,,押1付3,5500,低楼层/29层,87,汇景苑,中装
整租,距离地铁东风北桥535米,押2付3,4000,底层/6层,40,酒仙桥十街坊,中装
整租,距离地铁百子湾437米,押2付3,9000,中楼层/17层,94,金泰先锋,精装
整租,距离地铁望京南168米,押1付3,15000,高楼层/33层,149,蓝色家园,精装
整租,距离地铁太阳宫291米,押2付3,13000,底层/18层,100,半岛国际公寓,精装
整租,距离地铁南楼梓庄299米,押1付3,5000,中楼层/30层,55,官悦欣园,精装
整租,距离地铁百子湾993米,押2付3,21000,底层/19层,360,华北电力小区,精装
整租,距离地铁望京南679米,押2付3,5500,高楼层/6层,50,大山子南里,精装
整租,距离地铁黄渠653米,押1付3,2200,中楼层/11层,120,苹果派,中装
整租,距离地铁十里堡1164米,押2付3,2300,中楼层/15层,25,石佛营西里,精装
整租,距离地铁望京南679米,押2付3,6000,中楼层/6层,60,大山子南里,精装
整租,距离地铁大屯路东689米,押1付3,5500,高楼层/20层,55,安慧北里秀园,精装
整租,距离地铁建国门723米,押2付3,8000,中楼层/15层,69.72,美华世纪,中装
整租,距离地铁常营462米,押2付3,30000,底层/5层,70.25,万象新天四区,精装
整租,距离地铁望京西696米,押2付3,12000,顶层/13层,136,首开知语城,豪装
整租,距离地铁三元桥633米,押2付3,5600,高楼层/16层,47,三源里街,中装
合租,距离地铁十里堡556米,押2付3,2500,底层/6层,15,东八里庄东里北巷,精装
整租,距离地铁望京571米,押2付3,12000,中楼层/28层,140.4,望京明苑,精装
整租,距离地铁潘家园451米,押1付3,7200,顶层/6层,57.27,武圣西里,精装
整租,距离地铁常营654米,押2付3,15000,高楼层/23层,162,万象新天天际高尔夫,精装
整租,,押1付3,6000,低楼层/22层,88,东洲家园,中装
整租,距离地铁望京南1373米,押1付3,5800,低楼层/6层,55.24,花家地小区,简装
整租,距离地铁三元桥1013米,押2付3,5500,高楼层/16层,45,香河园中里,精装
整租,距离地铁东湖渠497米,押1付3,7800,中楼层/5层,81,望京花园西区,精装
整租,距离地铁太阳宫246米,押2付3,8000,底层/21层,75,新纪家园,豪装
整租,距离地铁光熙门448米,押2付3,17000,高楼层/23层,153.46,光熙家园,精装
整租,距离地铁广渠门外694米,押2付3,11000,中楼层/6层,110,双花园南里二区,精装
整租,,押2付3,5800,低楼层/20层,86,东洲家园,精装
合租,距离地铁阜通793米,押1付3,2200,低楼层/6层,55.08,花家地北里,精装
整租,距离地铁化工1466米,押1付3,6000,高楼层/6层,96,观音景园,精装
整租,距离地铁劲松335米,押1付3,6000,底层/12层,65,农光里小区,精装
整租,距离地铁安立路593米,押2付3,13500,高楼层/18层,116,阳光广场,精装
整租,距离地铁青年路280米,押2付3,4000,底层/14层,25,青年汇佳园,简装
整租,距离地铁望京西564米,押2付3,10000,高楼层/21层,126,银领国际,精装
整租,距离地铁十里堡858米,押2付3,4500,低楼层/28层,40,炫特嘉园,中装
整租,距离地铁北苑920米,押1付3,15000,顶层/7层,150,花语城,精装
整租,,押1付3,3500,顶层/6层,58,康静里,中装
整租,距离地铁建国门723米,押2付3,8500,低楼层/12层,89.61,美华世纪,中装
整租,距离地铁大望路391米,押2付3,8500,中楼层/32层,48,阳光100国际公寓,精装
整租,距离地铁欢乐谷景区277米,押2付3,12000,中楼层/12层,121.26,北京华侨城,精装
合租,距离地铁安立路1082米,押1付3,3500,低楼层/15层,20,汇园公寓,精装
整租,距离地铁欢乐谷景区1243米,押2付3,4600,中楼层/28层,56,翠成馨园E区,精装
整租,距离地铁四惠东685米,押0付3,11000,低楼层/9层,142.6,通惠家园惠生园,精装
整租,距离地铁十里堡222米,押1付3,6500,底层/6层,60,八里庄南里,简装
整租,距离地铁阜通597米,押1付3,5500,低楼层/18层,68,嘉悦精英家园,精装
整租,距离地铁北苑1463米,押2付3,25000,底层/4层,224.86,润泽庄园,简装
合租,距离地铁潘家园693米,押1付3,3100,中楼层/12层,25,华威西里,精装
整租,距离地铁柳芳829米,押2付3,7000,中楼层/20层,59.41,左家庄北里,精装
整租,距离地铁望京南679米,押2付3,6000,中楼层/6层,60,大山子南里,简装
整租,距离地铁大屯路东840米,押2付3,5000,高楼层/7层,50,育慧西里,精装
整租,距离地铁十里堡222米,押2付3,2300,高楼层/6层,60,八里庄南里,精装
整租,距离地铁十里河561米,押2付3,13000,高楼层/14层,163.6,龙头公寓,精装
合租,距离地铁柳芳957米,押1付3,2800,低楼层/6层,15,左家庄南里,精装
合租,距离地铁三元桥633米,押1付3,3000,中楼层/6层,15,三源里街,中装
整租,距离地铁百子湾943米,押2付3,15000,顶层/18层,145,沿海赛洛城六期,豪装
整租,距离地铁东大桥202米,押2付3,8500,顶层/6层,80,农丰里,精装
整租,距离地铁三元桥264米,押1付3,14000,低楼层/23层,132,国际港,精装
整租,距离地铁南楼梓庄839米,押1付3,13500,中楼层/21层,102.82,华瀚国际,精装
合租,距离地铁双井528米,押2付3,3500,底层/6层,60,黄木厂6号院,精装
整租,距离地铁欢乐谷景区1092米,押2付6,7500,高楼层/14层,130,翠成馨园A区,精装
整租,距离地铁安华桥653米,押2付3,6500,低楼层/16层,65,安华西里三区,中装
整租,距离地铁北工大西门879米,押2付3,7800,低楼层/20层,76.02,美景东方,精装
整租,,押2付3,6200,中楼层/22层,89,恒大江湾,精装
整租,距离地铁北工大西门702米,押1付3,6000,中楼层/4层,50.66,武圣东里,中装
整租,距离地铁东湖渠712米,押2付3,16000,底层/31层,114,东湖湾,中装
整租,距离地铁安立路833米,押2付3,23000,低楼层/17层,228,名人公寓,精装
整租,距离地铁望京308米,押2付3,7600,低楼层/22层,69,夏都盈座,精装
整租,距离地铁望京西868米,押2付3,24000,低楼层/13层,235,中广宜景湾,精装
整租,距离地铁大望路249米,押2付3,21000,中楼层/23层,168.71,蓝堡国际公寓,简装
整租,距离地铁双井359米,押1付3,20000,低楼层/21层,200,天之骄子,豪装
整租,距离地铁潘家园409米,押2付3,5500,中楼层/20层,60,松榆西里,中装
整租,距离地铁南楼梓庄619米,押1付6,10000,低楼层/21层,133,世纪东方城,精装
合租,距离地铁团结湖70米,押2付3,2600,高楼层/16层,20,团结湖北口,精装
合租,距离地铁惠新西街北口230米,押2付3,5500,底层/25层,90,千鹤家园,精装
整租,,押2付3,20000,高楼层/26层,276,银枫家园,精装
整租,距离地铁北苑路北841米,押1付3,14000,低楼层/16层,170,北卫新园,豪装
整租,距离地铁常营892米,押2付3,7000,低楼层/11层,110,柏林爱乐二期,精装
整租,距离地铁团结湖751米,押2付3,33000,低楼层/28层,209.37,三里屯SOHO公寓,精装
合租,,押2付3,2500,中楼层/26层,25,东洲家园,精装
整租,距离地铁管庄376米,押2付3,8500,高楼层/26层,130,东卫城,精装
整租,距离地铁亮马桥913米,押2付3,50000,顶层/20层,356.72,世方豪庭,精装
整租,,押2付3,6500,顶层/21层,90,东洲家园,精装
合租,距离地铁安立路568米,押1付3,2800,高楼层/16层,20,慧忠北里第二社区,中装
整租,距离地铁褡裢坡350米,押2付3,5000,低楼层/10层,70,福盈家园1号院,精装
整租,距离地铁东大桥755米,押2付3,1600,低楼层/5层,10,东大桥路,毛坯
整租,距离地铁大郊亭674米,押1付3,26000,中楼层/11层,127.46,后现代城,精装
整租,,押2付3,7500,中楼层/6层,120,朝阳新城五区,精装
合租,距离地铁阜通978米,押2付3,5000,低楼层/6层,143,花家地西里三区,精装
整租,距离地铁东四十条994米,押2付3,14000,中楼层/13层,118,杰座大厦,精装
整租,距离地铁呼家楼211米,押2付3,7500,高楼层/18层,69,向军北里,精装
整租,,押1付3,5800,低楼层/10层,55,利锦府,精装
整租,距离地铁南楼梓庄839米,押1付3,28000,低楼层/25层,233.61,华瀚国际,豪装
整租,距离地铁安德里北街1068米,押2付3,20000,低楼层/17层,123,泰利明苑,精装
整租,距离地铁欢乐谷景区1061米,押1付3,4000,中楼层/14层,55,翠成馨园C区,中装
整租,距离地铁安立路833米,押1付3,20000,中楼层/17层,228,名人公寓,中装
整租,距离地铁金台路250米,押2付3,6000,中楼层/6层,65,延静里,中装
整租,距离地铁四惠456米,押2付3,6000,低楼层/30层,40.9,远洋天地二期,中装
整租,距离地铁三元桥656米,押1付3,22000,中楼层/22层,175.81,太阳星城金星园,精装
整租,距离地铁北苑243米,押2付3,18000,中楼层/5层,206,时代庄园,中装
整租,距离地铁望京南906米,押1付3,23000,低楼层/27层,197,国风上观,精装
整租,距离地铁呼家楼497米,押1付3,6000,中楼层/20层,55,核桃园北里,中装
整租,距离地铁永安里157米,押2付3,60000,顶层/22层,447,丽晶苑,精装
整租,距离地铁九龙山774米,押1付3,7500,高楼层/22层,60.3,苹果社区南区,精装
整租,距离地铁百子湾437米,押2付3,13000,低楼层/19层,138,金泰先锋,中装
整租,距离地铁望京东717米,押1付3,25000,中楼层/19层,183.92,融科橄榄城,精装
整租,距离地铁双井769米,押2付3,18000,低楼层/32层,168,御宸上院,精装
整租,距离地铁北沙滩692米,押2付3,3000,低楼层/21层,20,懿品阁,精装
整租,距离地铁大望路236米,押2付3,36000,中楼层/28层,260.8,现代城,中装
整租,距离地铁大屯路东500米,押2付3,7300,中楼层/6层,65,安慧北里逸园,精装
整租,距离地铁黄渠653米,押2付3,7000,低楼层/11层,96,苹果派,精装
整租,距离地铁双井421米,押2付3,13000,低楼层/28层,126.8,百环家园,精装
整租,距离地铁四惠东1119米,押1付3,8000,中楼层/16层,98,百子湾家园C区,精装
整租,,押2付3,11000,低楼层/12层,120,利锦府,精装
合租,距离地铁十里堡864米,押2付3,2800,顶层/6层,25,十里堡北区,精装
距离地铁百子湾993米,距离地铁百子湾993米,押1付12,12000,高楼层/19层,159,华北电力小区,随时看房
随时看房,距离地铁大屯路东500米,押2付3,16000,低楼层/24层,180,安慧北里逸园,中装
整租,距离地铁常营1016米,押2付3,8000,高楼层/21层,95,管庄东里,精装
整租,距离地铁四惠东726米,押2付3,7500,中楼层/24层,83.95,都市经典家园,中装
整租,距离地铁褡裢坡830米,押2付3,24000,高楼层/8层,280,鲁班大厦,精装
整租,距离地铁南楼梓庄619米,押2付3,16000,高楼层/18层,196,世纪东方城,精装
整租,距离地铁大望路236米,押2付3,35000,低楼层/39层,266,现代城,中装
整租,距离地铁双桥521米,押1付3,7500,低楼层/6层,113,双惠苑,精装
整租,距离地铁北苑1329米,押1付3,14000,低楼层/24层,145,润泽公馆,精装
整租,距离地铁三元桥1111米,押2付3,6300,底层/6层,45,左家庄东里,精装
合租,距离地铁光熙门670米,押2付3,2240,高楼层/6层,20,北三环东路11号院,中装
整租,距离地铁潘家园693米,押2付3,4500,顶层/6层,50.35,华威西里,中装
整租,距离地铁阜通784米,押2付3,12000,中楼层/10层,101.63,金隅丽港城,精装
整租,距离地铁北工大西门1253米,押2付3,10000,低楼层/28层,121,周庄嘉园三期,精装
整租,距离地铁北工大西门627米,押1付3,5500,底层/6层,47,双龙南里,豪装
整租,,押2付3,7800,中楼层/8层,119,富北嘉园,精装
整租,距离地铁十里河561米,押2付3,11000,低楼层/14层,137,龙头公寓,中装
整租,距离地铁黄渠653米,押2付3,3000,低楼层/11层,77,苹果派,简装
整租,距离地铁九龙山271米,押2付3,9000,低楼层/16层,70,乐成豪丽,精装
整租,距离地铁望京南700米,押1付3,6500,高楼层/16层,58,高家园二区,精装
